[
  {
    "source": "storage-layout",
    "target": "bplus",
    "type": "prerequisite",
    "summary": "数据库 B+ 树的节点最终需要落到固定大小的数据页。",
    "strength": 3,
    "details": {},
    "status": "reviewed",
    "id": "storage-layout__bplus__prerequisite"
  },
  {
    "source": "binary-search",
    "target": "bplus",
    "type": "mechanism",
    "summary": "B+ 树节点内的 Key 有序，可使用边界定位快速选择子节点。",
    "strength": 3,
    "details": {},
    "status": "reviewed",
    "id": "binary-search__bplus__mechanism"
  },
  {
    "source": "hash",
    "target": "join",
    "type": "mechanism",
    "summary": "Hash Join 把一侧输入构造成哈希表，再用另一侧逐行探测。",
    "strength": 3,
    "details": {},
    "status": "reviewed",
    "id": "hash__join__mechanism"
  },
  {
    "source": "skiplist",
    "target": "redis-types",
    "type": "application",
    "summary": "Redis 使用跳表维护 ZSet 的分值顺序和范围查询。",
    "strength": 3,
    "details": {},
    "status": "reviewed",
    "id": "skiplist__redis-types__application"
  },
  {
    "source": "heap",
    "target": "sort",
    "type": "mechanism",
    "summary": "外部排序的 K 路归并使用堆维护各有序段的当前最小值。",
    "strength": 3,
    "details": {},
    "status": "reviewed",
    "id": "heap__sort__mechanism"
  },
  {
    "source": "lru-lfu",
    "target": "redis-eviction",
    "type": "mechanism",
    "summary": "Redis 采用近似 LRU/LFU 估计 Key 热度并选择淘汰对象。",
    "strength": 3,
    "details": {},
    "status": "reviewed",
    "id": "lru-lfu__redis-eviction__mechanism"
  },
  {
    "source": "buffer",
    "target": "query-path",
    "type": "mechanism",
    "summary": "查询访问的数据页通常先经过 Buffer Pool，而不是每次直接读取磁盘。",
    "strength": 3,
    "details": {},
    "status": "reviewed",
    "id": "buffer__query-path__mechanism"
  },
  {
    "source": "wal",
    "target": "buffer",
    "type": "composition",
    "summary": "WAL 允许 Buffer Pool 延迟写回脏页，同时维持崩溃恢复能力。",
    "strength": 3,
    "details": {},
    "status": "reviewed",
    "id": "wal__buffer__composition"
  },
  {
    "source": "wal",
    "target": "sequential-io",
    "type": "mechanism",
    "summary": "WAL 把分散的数据页更新转化为追加式顺序日志写。",
    "strength": 3,
    "details": {},
    "status": "reviewed",
    "id": "wal__sequential-io__mechanism"
  },
  {
    "source": "mvcc",
    "target": "locks",
    "type": "contrast",
    "summary": "两者都参与并发控制；MVCC 减少快照读阻塞，锁处理当前读和写冲突。",
    "strength": 3,
    "details": {
      "boundary": "MVCC 不能替代所有锁。"
    },
    "status": "reviewed",
    "id": "mvcc__locks__contrast"
  },
  {
    "source": "dist-consensus",
    "target": "kraft",
    "type": "mechanism",
    "summary": "KRaft 使用 Raft 风格的多数派复制管理 Kafka 元数据。",
    "strength": 3,
    "details": {},
    "status": "reviewed",
    "id": "dist-consensus__kraft__mechanism"
  },
  {
    "source": "cache-hierarchy",
    "target": "buffer",
    "type": "analogy",
    "summary": "两者都利用局部性，用有限的高速空间缓存慢速存储中的热点数据。",
    "strength": 3,
    "details": {
      "boundary": "CPU Cache 主要由硬件管理；Buffer Pool 由数据库管理并受 WAL 约束。"
    },
    "status": "reviewed",
    "id": "cache-hierarchy__buffer__analogy"
  },
  {
    "source": "epoll",
    "target": "go-runtime",
    "type": "mechanism",
    "summary": "Go Runtime 使用网络轮询器等待大量文件描述符的就绪事件。",
    "strength": 3,
    "details": {},
    "status": "reviewed",
    "id": "epoll__go-runtime__mechanism"
  },
  {
    "source": "go-stdlib",
    "target": "go-syntax",
    "type": "composition",
    "summary": "标准库接口把 Go 类型系统中的方法集与隐式实现落到工程代码中。",
    "strength": 1,
    "details": {},
    "status": "reviewed",
    "id": "go-stdlib__go-syntax__composition"
  },
  {
    "source": "go-channel",
    "target": "go-select",
    "type": "composition",
    "summary": "Channel 负责通信，select 负责协调多个 Channel 事件。",
    "strength": 3,
    "details": {},
    "status": "reviewed",
    "id": "go-channel__go-select__composition"
  },
  {
    "source": "go-context",
    "target": "go-errgroup",
    "type": "composition",
    "summary": "Context 传播取消，errgroup 汇总并发任务错误和生命周期。",
    "strength": 3,
    "details": {},
    "status": "reviewed",
    "id": "go-context__go-errgroup__composition"
  },
  {
    "source": "ai-attention",
    "target": "ai-kv-cache",
    "type": "prerequisite",
    "summary": "KV Cache 保存每层 Attention 已计算的 Key 和 Value。",
    "strength": 3,
    "details": {},
    "status": "reviewed",
    "id": "ai-attention__ai-kv-cache__prerequisite"
  },
  {
    "source": "ai-rag",
    "target": "ai-agent",
    "type": "composition",
    "summary": "Agent 可以把检索作为工具，为规划和回答补充外部知识。",
    "strength": 3,
    "details": {},
    "status": "reviewed",
    "id": "ai-rag__ai-agent__composition"
  },
  {
    "source": "cache-hierarchy",
    "target": "ai-kv-cache",
    "type": "analogy",
    "summary": "两者都用额外存储避免重复计算或慢速访问。",
    "strength": 3,
    "details": {
      "boundary": "KV Cache 保存模型中间张量，不是硬件自动管理的数据缓存。"
    },
    "status": "reviewed",
    "id": "cache-hierarchy__ai-kv-cache__analogy"
  },
  {
    "source": "vector",
    "target": "ai-rag",
    "type": "mechanism",
    "summary": "向量索引为 RAG 提供近似最近邻召回。",
    "strength": 3,
    "details": {},
    "status": "reviewed",
    "id": "vector__ai-rag__mechanism"
  },
  {
    "source": "sliding-window",
    "target": "sd-rate-limiter",
    "type": "application",
    "summary": "滑动窗口按最近一段时间的请求记录执行限流。",
    "strength": 3,
    "details": {},
    "status": "reviewed",
    "id": "sliding-window__sd-rate-limiter__application"
  },
  {
    "source": "kafka-overview",
    "target": "sd-push-system",
    "type": "application",
    "summary": "推送系统使用 Kafka 解耦消息生产、分发和消费。",
    "strength": 3,
    "details": {},
    "status": "reviewed",
    "id": "kafka-overview__sd-push-system__application"
  },
  {
    "source": "redis-lock",
    "target": "sd-flash-sale",
    "type": "application",
    "summary": "秒杀流程可使用分布式锁保护少量必须串行化的共享操作。",
    "strength": 3,
    "details": {},
    "status": "reviewed",
    "id": "redis-lock__sd-flash-sale__application"
  },
  {
    "source": "http2",
    "target": "grpc",
    "type": "prerequisite",
    "summary": "gRPC 使用 HTTP/2 的多路复用、流和头部压缩承载 RPC 通信。",
    "strength": 3,
    "details": {},
    "status": "reviewed",
    "id": "http2__grpc__prerequisite"
  },
  {
    "source": "http2",
    "target": "tls",
    "type": "composition",
    "summary": "HTTP/2 通常与 TLS 协同部署，但二者分别负责应用层传输与安全通信。",
    "strength": 1,
    "details": {},
    "status": "reviewed",
    "id": "http2__tls__composition"
  },
  {
    "source": "http2",
    "target": "quic",
    "type": "causal",
    "summary": "HTTP/2 的多个流仍共享 TCP 丢包恢复，推动 HTTP/3 转向 QUIC 独立流。",
    "strength": 3,
    "details": {},
    "status": "reviewed",
    "id": "http2__quic__causal"
  },
  {
    "source": "ai-embedding",
    "target": "ai-rag",
    "type": "mechanism",
    "summary": "RAG 使用 Embedding 将查询和文档映射到可检索的语义空间。",
    "strength": 3,
    "details": {},
    "status": "reviewed",
    "id": "ai-embedding__ai-rag__mechanism"
  },
  {
    "source": "bloom",
    "target": "sd-webcrawler",
    "type": "application",
    "summary": "网络爬虫使用 Bloom Filter 低成本排除已经访问过的 URL。",
    "strength": 3,
    "details": {},
    "status": "reviewed",
    "id": "bloom__sd-webcrawler__application"
  },
  {
    "source": "ai-kv-cache",
    "target": "ai-inference-serving",
    "type": "mechanism",
    "summary": "推理服务需要管理每个请求的 KV Cache 生命周期和显存占用。",
    "strength": 3,
    "details": {},
    "status": "reviewed",
    "id": "ai-kv-cache__ai-inference-serving__mechanism"
  },
  {
    "source": "algo-search-trees",
    "target": "algo-bplus",
    "type": "prerequisite",
    "summary": "B+ 树继承 B 树的多路平衡、节点分裂和高度控制机制。",
    "strength": 3,
    "details": {},
    "status": "reviewed",
    "id": "algo-search-trees__algo-bplus__prerequisite"
  },
  {
    "source": "bplus",
    "target": "query-path",
    "type": "mechanism",
    "summary": "查询执行器通过 B+ 树索引减少需要读取的数据页。",
    "strength": 3,
    "details": {},
    "status": "reviewed",
    "id": "bplus__query-path__mechanism"
  },
  {
    "source": "algo-linked-list",
    "target": "algo-stack",
    "type": "mechanism",
    "summary": "链表可以通过头部插入和删除实现 O(1) 的栈操作。",
    "strength": 3,
    "details": {},
    "status": "reviewed",
    "id": "algo-linked-list__algo-stack__mechanism"
  },
  {
    "source": "algo-linked-list",
    "target": "algo-queue",
    "type": "mechanism",
    "summary": "维护首尾指针的链表可以实现 O(1) 入队和出队。",
    "strength": 3,
    "details": {},
    "status": "reviewed",
    "id": "algo-linked-list__algo-queue__mechanism"
  },
  {
    "source": "binary-search",
    "target": "algo-dynamic-programming",
    "type": "mechanism",
    "summary": "最长递增子序列的 O(n log n) 解法使用二分查找维护最小结尾数组。",
    "strength": 3,
    "details": {},
    "status": "reviewed",
    "id": "binary-search__algo-dynamic-programming__mechanism"
  },
  {
    "source": "go-syntax",
    "target": "go-embedding",
    "type": "prerequisite",
    "summary": "理解 Go 的类型与方法集后，才能准确判断嵌入带来的方法提升行为。",
    "strength": 3,
    "details": {},
    "status": "reviewed",
    "id": "go-syntax__go-embedding__prerequisite"
  },
  {
    "source": "go-syntax",
    "target": "go-closure",
    "type": "prerequisite",
    "summary": "闭包建立在函数值、词法作用域和变量生命周期等语言基础之上。",
    "strength": 3,
    "details": {},
    "status": "reviewed",
    "id": "go-syntax__go-closure__prerequisite"
  },
  {
    "source": "go-error",
    "target": "go-defer-panic",
    "type": "contrast",
    "summary": "普通错误应显式返回，panic/recover 主要处理无法按正常控制流继续的异常边界。",
    "strength": 3,
    "details": {},
    "status": "reviewed",
    "id": "go-error__go-defer-panic__contrast"
  },
  {
    "source": "heap",
    "target": "algo-sorting",
    "type": "application",
    "summary": "排序专题中的堆排序使用完全二叉堆的建堆和下沉操作完成原地排序，并关联到更常见的 Top-K 场景。",
    "strength": 3,
    "details": {},
    "status": "reviewed",
    "id": "heap__algo-sorting__application"
  },
  {
    "source": "hash",
    "target": "bloom",
    "type": "prerequisite",
    "summary": "Bloom Filter 依赖多个哈希函数把元素映射到位数组位置。",
    "strength": 3,
    "details": {},
    "status": "reviewed",
    "id": "hash__bloom__prerequisite"
  },
  {
    "source": "hash",
    "target": "db-hash-index",